{
  "$schema": "https://json-schema.org/draft/2020-12/schema",
  "$id": "job-search/cover-letter",
  "title": "CoverLetter",
  "type": "object",
  "required": ["id", "application_id", "markdown", "sha"],
  "properties": {
    "id": { "type": "string" },
    "application_id": { "type": "string" },
    "style": { "type": ["string", "null"] },
    "tone": { "type": ["string", "null"] },
    "markdown": { "type": "string" },
    "sha": { "type": "string" },
    "generated_by_model": { "type": ["string", "null"] }
  },
  "additionalProperties": true
}
